{
  "results_version": "0.1",
  "model_hash": "80d5972dcfeda8112a0b8dcb9b74f74aef92978b5adb3e63f568c8a941d1ae04",
  "engine": {
    "name": "cfdl-engine",
    "version": "0.1.0"
  },
  "warnings": [],
  "deterministic": {
    "status": "ok",
    "metrics": {
      "entity.legal.borrower.total": {
        "amount": -12000.0,
        "currency": "USD"
      },
      "model.npv": {
        "amount": -7495.061005,
        "currency": "USD"
      },
      "model.total": {
        "amount": -12000.0,
        "currency": "USD"
      },
      "run.discount_rate": 0.1,
      "stream.legal.rent.total": {
        "amount": -12000.0,
        "currency": "USD"
      }
    },
    "series": {
      "model.net_cash_flow": {
        "index": {
          "calendar": "monthly",
          "start": "2026-01-01",
          "periods": 12
        },
        "values": [
          {
            "amount": -1000.0,
            "currency": "USD"
          },
          {
            "amount": -1000.0,
            "currency": "USD"
          },
          {
            "amount": -1000.0,
            "currency": "USD"
          },
          {
            "amount": -1000.0,
            "currency": "USD"
          },
          {
            "amount": -1000.0,
            "currency": "USD"
          },
          {
            "amount": -1000.0,
            "currency": "USD"
          },
          {
            "amount": -1000.0,
            "currency": "USD"
          },
          {
            "amount": -1000.0,
            "currency": "USD"
          },
          {
            "amount": -1000.0,
            "currency": "USD"
          },
          {
            "amount": -1000.0,
            "currency": "USD"
          },
          {
            "amount": -1000.0,
            "currency": "USD"
          },
          {
            "amount": -1000.0,
            "currency": "USD"
          }
        ]
      },
      "stream.legal.rent": {
        "index": {
          "calendar": "monthly",
          "start": "2026-01-01",
          "periods": 12
        },
        "values": [
          {
            "amount": -1000.0,
            "currency": "USD"
          },
          {
            "amount": -1000.0,
            "currency": "USD"
          },
          {
            "amount": -1000.0,
            "currency": "USD"
          },
          {
            "amount": -1000.0,
            "currency": "USD"
          },
          {
            "amount": -1000.0,
            "currency": "USD"
          },
          {
            "amount": -1000.0,
            "currency": "USD"
          },
          {
            "amount": -1000.0,
            "currency": "USD"
          },
          {
            "amount": -1000.0,
            "currency": "USD"
          },
          {
            "amount": -1000.0,
            "currency": "USD"
          },
          {
            "amount": -1000.0,
            "currency": "USD"
          },
          {
            "amount": -1000.0,
            "currency": "USD"
          },
          {
            "amount": -1000.0,
            "currency": "USD"
          }
        ]
      }
    }
  },
  "scenarios": {
    "status": "not_run",
    "summaries": []
  },
  "monte_carlo": {
    "status": "not_run",
    "trials": 1,
    "seed": 0,
    "metrics": {},
    "trial_summaries": []
  }
}