{
  "results_version": "0.1",
  "model_hash": "72d531d9a3f0d6e5df7d76f37884718dc8183aace9214fa59cf7e2fd6f1ca24f",
  "engine": {
    "name": "cfdl-engine",
    "version": "0.1.0"
  },
  "warnings": [],
  "deterministic": {
    "status": "ok",
    "metrics": {
      "entity.real_estate.property.total": {
        "amount": 450000.0,
        "currency": "USD"
      },
      "model.npv": {
        "amount": 127310.791316,
        "currency": "USD"
      },
      "model.total": {
        "amount": 450000.0,
        "currency": "USD"
      },
      "run.discount_rate": 0.1,
      "stream.cre.lease.base_rent.total": {
        "amount": 450000.0,
        "currency": "USD"
      }
    },
    "series": {
      "model.net_cash_flow": {
        "index": {
          "calendar": "monthly",
          "start": "2026-01-01",
          "periods": 24
        },
        "values": [
          {
            "amount": 0.0,
            "currency": "USD"
          },
          {
            "amount": 0.0,
            "currency": "USD"
          },
          {
            "amount": 0.0,
            "currency": "USD"
          },
          {
            "amount": 0.0,
            "currency": "USD"
          },
          {
            "amount": 0.0,
            "currency": "USD"
          },
          {
            "amount": 0.0,
            "currency": "USD"
          },
          {
            "amount": 25000.0,
            "currency": "USD"
          },
          {
            "amount": 25000.0,
            "currency": "USD"
          },
          {
            "amount": 25000.0,
            "currency": "USD"
          },
          {
            "amount": 25000.0,
            "currency": "USD"
          },
          {
            "amount": 25000.0,
            "currency": "USD"
          },
          {
            "amount": 25000.0,
            "currency": "USD"
          },
          {
            "amount": 25000.0,
            "currency": "USD"
          },
          {
            "amount": 25000.0,
            "currency": "USD"
          },
          {
            "amount": 25000.0,
            "currency": "USD"
          },
          {
            "amount": 25000.0,
            "currency": "USD"
          },
          {
            "amount": 25000.0,
            "currency": "USD"
          },
          {
            "amount": 25000.0,
            "currency": "USD"
          },
          {
            "amount": 25000.0,
            "currency": "USD"
          },
          {
            "amount": 25000.0,
            "currency": "USD"
          },
          {
            "amount": 25000.0,
            "currency": "USD"
          },
          {
            "amount": 25000.0,
            "currency": "USD"
          },
          {
            "amount": 25000.0,
            "currency": "USD"
          },
          {
            "amount": 25000.0,
            "currency": "USD"
          }
        ]
      },
      "stream.cre.lease.base_rent": {
        "index": {
          "calendar": "monthly",
          "start": "2026-01-01",
          "periods": 24
        },
        "values": [
          {
            "amount": 0.0,
            "currency": "USD"
          },
          {
            "amount": 0.0,
            "currency": "USD"
          },
          {
            "amount": 0.0,
            "currency": "USD"
          },
          {
            "amount": 0.0,
            "currency": "USD"
          },
          {
            "amount": 0.0,
            "currency": "USD"
          },
          {
            "amount": 0.0,
            "currency": "USD"
          },
          {
            "amount": 25000.0,
            "currency": "USD"
          },
          {
            "amount": 25000.0,
            "currency": "USD"
          },
          {
            "amount": 25000.0,
            "currency": "USD"
          },
          {
            "amount": 25000.0,
            "currency": "USD"
          },
          {
            "amount": 25000.0,
            "currency": "USD"
          },
          {
            "amount": 25000.0,
            "currency": "USD"
          },
          {
            "amount": 25000.0,
            "currency": "USD"
          },
          {
            "amount": 25000.0,
            "currency": "USD"
          },
          {
            "amount": 25000.0,
            "currency": "USD"
          },
          {
            "amount": 25000.0,
            "currency": "USD"
          },
          {
            "amount": 25000.0,
            "currency": "USD"
          },
          {
            "amount": 25000.0,
            "currency": "USD"
          },
          {
            "amount": 25000.0,
            "currency": "USD"
          },
          {
            "amount": 25000.0,
            "currency": "USD"
          },
          {
            "amount": 25000.0,
            "currency": "USD"
          },
          {
            "amount": 25000.0,
            "currency": "USD"
          },
          {
            "amount": 25000.0,
            "currency": "USD"
          },
          {
            "amount": 25000.0,
            "currency": "USD"
          }
        ]
      }
    }
  },
  "scenarios": {
    "status": "not_run",
    "summaries": []
  },
  "monte_carlo": {
    "status": "not_run",
    "trials": 1,
    "seed": 0,
    "metrics": {},
    "trial_summaries": []
  }
}